<xs:schema attributeFormDefault="unqualified" elementFormDefault="qualified"
    xmlns:xs="http://www.w3.org/2001/XMLSchema">
    <xs:element name="page">
        <xs:complexType>
            <xs:sequence>
                <xs:element type="xs:string" name="title" />
                <xs:element name="body">
                    <xs:complexType>
                        <xs:sequence>
                            <xs:element name="paragraph" maxOccurs="unbounded">
                                <xs:complexType>
                                    <xs:sequence>
                                        <xs:element type="xs:string" name="content" />
                                        <xs:element type="xs:string" name="comment" />
                                    </xs:sequence>
                                </xs:complexType>
                            </xs:element>
                        </xs:sequence>
                    </xs:complexType>
                </xs:element>
            </xs:sequence>
        </xs:complexType>
    </xs:element>
</xs:schema>